{"artifact_files":{"agreement.json":{"bytes":26277,"gzip_bytes":7194,"sha256":"e9bfdbeb11184c3ee082f7df624d293c96fc4e7cc25f4adcd10a68713185cf62"},"ar6.json":{"bytes":4153,"gzip_bytes":1339,"sha256":"ae58a049fe057e1cb388a7f8021f294ceafaec85b4c94bcc8248e5e67ef62813"},"changepoints.json":{"bytes":9930,"gzip_bytes":3419,"sha256":"d6f39c5795a802d7c9139e798cb34cdb9132e1100fa6faaed00e5a4d18d70b29"},"co2.json":{"bytes":55779,"gzip_bytes":9115,"sha256":"bca0db47039d8b227fbabd3c13dc6316a63ebc02cf9a34cfe6fc7716805eacc1"},"coastlines.json":{"bytes":66922,"gzip_bytes":26408,"sha256":"92c05b8f90cb3816e851438f222cec1d5ab3d8772c6c49092333c582dd88a6eb"},"extremes.json":{"bytes":25794,"gzip_bytes":5697,"sha256":"05af766bcd3d4abf30a104075908443123f12a14d94a13eeb1e6b6f9276d7e7c"},"facts.json":{"bytes":8653,"gzip_bytes":2266,"sha256":"d63b5eae12932a202224329362fb9f5ee1fcc08b27684233ce94987d6469f248"},"grid_gistemp_2deg.i8.bin.gz":{"bytes":600101,"gzip_bytes":600101,"sha256":"68c745b43016fe25f722006935dd8e5743bf1335b2614382bc4191bb2eb956f6"},"grid_gistemp_2deg.meta.json":{"bytes":91036,"gzip_bytes":14996,"sha256":"9e428d9d3baf53d893ee7bf0dc653fefc84a0d23396171708e81ff95ef7cd5b8"},"grid_gistemp_2deg_intro.i8.bin.gz":{"bytes":67647,"gzip_bytes":67647,"sha256":"332c6ed8a7cc1135c937da7fe5e846aaf9db2edb8647bba870dc1ee33a3b3388"},"grid_gistemp_2deg_intro.meta.json":{"bytes":88749,"gzip_bytes":14158,"sha256":"3389e4604a8eeb7fd1b23ca388c8e79a9a249b02f002c9c61ab886ef96ef377e"},"grid_hadcrut5_5deg.i8.bin.gz":{"bytes":159623,"gzip_bytes":159623,"sha256":"de8dbe6846c3c926716afa02f1d2ce2dee5fe742f8b9da2241858f8a4f601679"},"grid_hadcrut5_5deg.meta.json":{"bytes":34452,"gzip_bytes":8929,"sha256":"bf66658651917d2ac3a5fe6033d8508460fa7b551948198897a58bb3f9035f08"},"grid_trends_gistemp_2deg.i8.bin.gz":{"bytes":24382,"gzip_bytes":24382,"sha256":"43c1d97b3a7e478014070352a5292106d09232dc809ca2cef8b9aa017aadd468"},"grid_trends_gistemp_2deg.meta.json":{"bytes":2096,"gzip_bytes":1022,"sha256":"b55179b36cdcbe90da7dad3a4e57a63db736f41ac3ac490918a9adb7e13b916b"},"grid_trends_hadcrut5_5deg.i8.bin.gz":{"bytes":6319,"gzip_bytes":6319,"sha256":"6981993136903d6577b5bd802a403e5e95c8507d747a110acb62e42f9eff0916"},"grid_trends_hadcrut5_5deg.meta.json":{"bytes":2083,"gzip_bytes":1012,"sha256":"678c89eaa8596ea323c163872e8ad4428f3582a1787c6abada9df3dc4819a085"},"land_fraction.json":{"bytes":50556,"gzip_bytes":5565,"sha256":"36842e077a491f1787c7faed043b8f8ef6ba2c45fb574117a75ce22013039046"},"reconciliation.json":{"bytes":4127,"gzip_bytes":1079,"sha256":"ce504bd5d847165d0249ff2a21f9e71dd08b140d47c8792bb5e4ae271f758471"},"regional.json":{"bytes":53479,"gzip_bytes":14884,"sha256":"9d586232c91d5586f9db2bc7008c112b58425bc13a87ca138a48d25175ddb93f"},"series_annual.json":{"bytes":50157,"gzip_bytes":14502,"sha256":"164e97c95bf9b9a0b2dbfaec414abe7bb633d4fe0c56223cffa9fe15a62e95be"},"series_monthly.json":{"bytes":149335,"gzip_bytes":43305,"sha256":"6b79921e99034a1140a6e1129c3a6655317b0d81eb4757abfc93da6f9f7b0f31"},"trends.json":{"bytes":56198,"gzip_bytes":13592,"sha256":"a5d2881880f70e7a57c1c45542378ba4f3a93bd5006ce7e4b92f475811989b2c"},"validation.json":{"bytes":3732,"gzip_bytes":1488,"sha256":"9c9b740ff76ddf66a4861bebe19242b56953d0918cefe0cd413917ab3c5f32ea"},"zonal_fixture.json":{"bytes":14793,"gzip_bytes":4253,"sha256":"9f0f56cdf2a15ea6a49b0abd883653b021344994a2c8c01ce6d2c5175b1bc412"}},"baseline_notes":"GISTEMP native 1951-1980; HadCRUT5 native 1961-1990; AR6 1850-1900. Offered baselines: 1850-1900 (HadCRUT5 only), 1951-1980, 1991-2020. Every conversion is recorded; no series is silently mixed.","baselines":["1850-1900","1951-1980","1991-2020"],"generated_at":"2026-10-11T02:42:50+00:00","limitations":["Anomalies, not absolute temperatures; baselines differ between products and are always rebased explicitly (see series_annual.conversions).","GISTEMP smooths station anomalies up to 1200 km, so its pre-1950 and Arctic coverage is higher than HadCRUT5's; that is the source's smoothing, not ours. Missing cells stay missing.","Land-only vs land-ocean compares two GISTEMP products; no ocean-only series is published in the files used.","Annual-mean anomalies are not extreme-event data: the extremes metric is the area share of unusually warm or cold ANNUAL means.","Trend intervals assume AR(1) residuals (or HAC); real climate noise is more complex. The simulation in validation.json shows coverage on synthetic AR(1) noise only.","Change-point results are EXPLORATORY; a smooth curved trend also produces apparent breaks.","CO2 vs temperature is association only; both series trend, so level correlation is inflated by construction.","AR6 ranges are published IPCC assessed values for 20-year averages relative to 1850-1900, not our forecasts; the AR6 licence page could not be verified.","Grids are quantized to 0.1 C Int8 (max error 0.05 C) and annual cell means require 9 of 12 valid months.","Berkeley Earth was not used (CC BY-NC); no third independent record is shown."],"pipeline_version":"1.0.0","schema_version":"v1","sources":{"gistemp_glb_landocean":{"bytes":12886,"citation":"GISTEMP Team, 2026.","last_modified":"Thu, 08 Oct 2026 11:30:14 GMT","license_note":"As above.","name":"NASA GISTEMP v4 global land-ocean monthly","native_baseline":"1951-1980","retrieved_at":"2026-10-11T02:15:04+00:00","sha256":"4c64eda288bce32b8d76926278f346ecea1e53506df8ee72a3d5accb0657c416","tag":"OBSERVED","url":"https://data.giss.nasa.gov/gistemp/tabledata_v4/GLB.Ts+dSST.csv","version":"GISTEMP v4"},"gistemp_glb_landonly":{"bytes":12986,"citation":"GISTEMP Team, 2026.","last_modified":"Thu, 08 Oct 2026 11:30:14 GMT","license_note":"As above.","name":"NASA GISTEMP v4 global land-only (meteorological stations) monthly","native_baseline":"1951-1980","retrieved_at":"2026-10-11T02:15:05+00:00","sha256":"0ba691cd181374b2aa8c1289a125504e3e892911747c5554e0c7414502135ab5","tag":"OBSERVED","url":"https://data.giss.nasa.gov/gistemp/tabledata_v4/GLB.Ts.csv","version":"GISTEMP v4"},"gistemp_grid_nc_gz":{"bytes":25866289,"citation":"GISTEMP Team, 2026: GISS Surface Temperature Analysis (GISTEMP), version 4. NASA Goddard Institute for Space Studies. https://data.giss.nasa.gov/gistemp/","last_modified":"Thu, 08 Oct 2026 11:32:32 GMT","license_note":"No data licence stated by GISS; acknowledgment requested (NASA GISS/GISTEMP). Formal data licence unverified.","name":"NASA GISTEMP v4 gridded 1200 km (GHCNv4 + ERSSTv5)","native_baseline":"1951-1980","retrieved_at":"2026-10-11T02:15:03+00:00","sha256":"44c8a2d358d73a5488232cedda387c6e6501671f9d2286b5c656f5a4efb43796","tag":"OBSERVED","url":"https://data.giss.nasa.gov/pub/gistemp/gistemp1200_GHCNv4_ERSSTv5.nc.gz","version":"GISTEMP v4"},"gistemp_nh_landocean":{"bytes":12937,"citation":"GISTEMP Team, 2026.","last_modified":"Thu, 08 Oct 2026 11:30:14 GMT","license_note":"As above.","name":"NASA GISTEMP v4 Northern Hemisphere monthly","native_baseline":"1951-1980","retrieved_at":"2026-10-11T02:15:04+00:00","sha256":"e78c78f807ac34d6c113160189b2b18613fbcfe2e8de9e4d5a34fddf72a39326","tag":"OBSERVED","url":"https://data.giss.nasa.gov/gistemp/tabledata_v4/NH.Ts+dSST.csv","version":"GISTEMP v4"},"gistemp_sh_landocean":{"bytes":12868,"citation":"GISTEMP Team, 2026.","last_modified":"Thu, 08 Oct 2026 11:30:14 GMT","license_note":"As above.","name":"NASA GISTEMP v4 Southern Hemisphere monthly","native_baseline":"1951-1980","retrieved_at":"2026-10-11T02:15:05+00:00","sha256":"e856610fc523b192bb5f64d7d0024acf6e94ae48cd8cd9d709b797d9e238d82c","tag":"OBSERVED","url":"https://data.giss.nasa.gov/gistemp/tabledata_v4/SH.Ts+dSST.csv","version":"GISTEMP v4"},"hadcrut5_global_annual":{"bytes":7046,"citation":"Morice et al. (2021).","last_modified":"Fri, 02 Oct 2026 13:06:26 GMT","license_note":"Open Government Licence v3.0.","name":"HadCRUT5 global annual summary series with 95% CI","native_baseline":"1961-1990","retrieved_at":"2026-10-11T02:18:00+00:00","sha256":"7f750b673bb34aad722736ee21f122b5ea692c99877fa0b1066df65e51f32c04","tag":"OBSERVED","url":"https://www.metoffice.gov.uk/hadobs/hadcrut5/data/HadCRUT.5.2.0.0/analysis/diagnostics/HadCRUT.5.2.0.0.analysis.summary_series.global.annual.csv","version":"HadCRUT.5.2.0.0"},"hadcrut5_global_monthly":{"bytes":89634,"citation":"Morice et al. (2021).","last_modified":"Fri, 02 Oct 2026 13:06:26 GMT","license_note":"Open Government Licence v3.0.","name":"HadCRUT5 global monthly summary series with 95% CI","native_baseline":"1961-1990","retrieved_at":"2026-10-11T02:15:08+00:00","sha256":"dd4449a3e25b75396ec4f0445f8647e5b9f5a10f3993929fb82918f3ec135dd1","tag":"OBSERVED","url":"https://www.metoffice.gov.uk/hadobs/hadcrut5/data/HadCRUT.5.2.0.0/analysis/diagnostics/HadCRUT.5.2.0.0.analysis.summary_series.global.monthly.csv","version":"HadCRUT.5.2.0.0"},"hadcrut5_grid_nc":{"bytes":32842962,"citation":"Morice, C. P. et al. (2021), An updated assessment of near-surface temperature change from 1850: the HadCRUT5 data set, J. Geophys. Res. Atmos., 126, e2019JD032361, doi:10.1029/2019JD032361","last_modified":"Fri, 02 Oct 2026 13:06:24 GMT","license_note":"Open Government Licence v3.0 (stated in the file attributes).","name":"HadCRUT5 analysis ensemble-mean grid","native_baseline":"1961-1990","retrieved_at":"2026-10-11T02:15:08+00:00","sha256":"75728d3c91a7283c19911ff616c9210660f7f7007911bbcfe3698776194fc728","tag":"OBSERVED","url":"https://www.metoffice.gov.uk/hadobs/hadcrut5/data/HadCRUT.5.2.0.0/analysis/HadCRUT.5.2.0.0.analysis.anomalies.ensemble_mean.nc","version":"HadCRUT.5.2.0.0"},"hadcrut5_nh_annual":{"bytes":7027,"citation":"Morice et al. (2021).","last_modified":"Fri, 02 Oct 2026 13:06:26 GMT","license_note":"Open Government Licence v3.0.","name":"HadCRUT5 NH annual","native_baseline":"1961-1990","retrieved_at":"2026-10-11T02:18:02+00:00","sha256":"51154ebde6d36df58b7dd2d99df7d57654535693859a6f09e28f1be77e0b28e1","tag":"OBSERVED","url":"https://www.metoffice.gov.uk/hadobs/hadcrut5/data/HadCRUT.5.2.0.0/analysis/diagnostics/HadCRUT.5.2.0.0.analysis.summary_s